municipality,state,Country,admin_scale,lat,lng,passed,policy_summary,range,policy_type,link,resource,state_level_legal_status,state_level_legal_summary,point_total,pts_eviction_initiation_tot_10,pts_eviction_protect_tot_04,pts_eviction_pending_tot_03,pts_tenant_action_tot_00,pts_partial_rent_tot_01,pts_repayment_period_tot_05,pts_latefees_tot_03,pts_repayment_plan_tot_00,pts_courts_tot_15,pts_renter_protection_tot_06,ISO
Montana,Montana,United States,State,47.3752671,-109.6387579,TRUE,"For individuals who are members of a vulnerable population and who, pursuant to this Directive, remain sheltered at home, the protections of the March 30 and April 13 Directives will expire 30 days after the individual ceases to shelter at home or at the end of the emergency, whichever is sooner. 

original rules: No landlord shall:
There shall be no actions for termination of a tenancy, possession, unlawful holdover, or rent involving a residential dwelling tenancy. No writ, judgment, or order requiring a tenant or authorized guest to surrender or vacate the premises shall be enforced. 

Terminate a tenancy or refuse to renew or extend the terms of a residential dwelling tenancy on at least a month-to-month basis;  
o charge or accrue late fees, interest, or other charges, penalties, or amounts due because of nonpayment of rent for the duration of this Directive;  
o increase the amount of rent payable under the terms of a rental agreement (except previously agreed increases or reasonable increases reflecting the size of the unit, number of tenants or guests, or services provided by the landlord);
o request the suspension or termination of any utilities provided to the tenant based upon nonpayment of utilities, rents, or other amounts due under the rental agreement; or
o report a residential tenant to a credit bureau for nonpayment of a financial obligation.",2,Eviction Protection,https://covid19.mt.gov/Portals/223/Documents/04-22-20%20Directive%20and%20Appx%20-%20Reopening%20Phase%20One.pdf?ver=2020-04-22-124954-977,,COVID-19 Related Eviction Cases Suspended,"Montana Governor Steve Bullock issued an order on March 30th prohibiting landlords from terminating a lease or refusing to renew/ extend the terms of a current lease agreement, at least on a month-to-month basis. This order was extended through April 24th but also significantly limited. The new order provides for a rental assistance program, but limits the eviction protections of the first order to tenants under quarantine, self-quarantine, or experiencing loss of inclome due to COVID-19.The governor's order also prohibits suspension of utilities during the emergency, including electricity, gas, sewage disposal, water, telephone, or internet services, and prohibits late fees for bills due. The Supreme Court of Montana supsended all civil cases.",-2,0,0,0,0,0,0,4,0,-7,1,USA
New York,New York,United States,State,40.7127281,-74.0060152,TRUE,"he Chief Administrative Judge of the State of New York Unified Court System's 3/15/20 memorandum states that ""all eviction proceedings and pending eviction orders shall be suspended statewide until further notice."" The Chief Administrative Judge had initially issued a one-week moratorium in New York City on 3/13/20. There will be no evictions of any kind, for anyone, as long as the 3/15/20 moratorium is in place. In NYC, all city marshals have been notified that they cannot execute any pre-existing warrants. Outside of NYC, law enforcement entities should have been notified by the local courts.  The Governor's 3/20/20 Executive Order declared an eviction and foreclosure morotorium for 90 days.",1,,,,Eviction Cases & Enforcement Suspended,"The Chief Administrative Judge of the State of New York Unified Court System's 3/15/20 memorandum states that  ""all eviction proceedings and pending eviction orders shall be suspended statewide until further notice."" The Chief Administrative Judge had initially issued a one-week moratorium in New York City on 3/13/20. There will be no evictions of any kind, for anyone, as long as the 3/15/20 moratorium is in place. In NYC, all city marshals have been notified that they cannot execute any pre-existing warrants. Outside of NYC, law enforcement entities should have been notified by the local courts. The Governor's 3/20/20 Executive Order declared an eviction and foreclosure morotorium for 90 days.",3,0,0,0,0,0,0,2,0,1,0,USA
Vermont,Vermont,United States,State,44.5990718,-72.5002608,TRUE,Suspends hearings on evictions except in emergency landlord tenant hearings,2,,https://www.vermontjudiciary.org/sites/default/files/documents/AO%2049%20-%20Declaration%20of%20Judicial%20Emergency%20and%20Changes%20to%20Court%20Procedures%20with%20amendments%20through%204-9-20.pdf,,Eviction Cases Suspended,"The Supreme Court of Vermont has suspended all non-emergency civil cases, at the discretion of the judge, and the state legislature is considering emergency legislation that would create a moratorium on evictions.",2,0,0,0,0,0,0,2,0,0,0,USA
District Of Columbia,District Of Columbia,United States,City,38.89366125,-76.987883253882,TRUE,"The DC Superior Court suspended landlord tenant and civil cases and stayed eviction and foreclosure cases until at least May 1. The D.C. Council passed emergency legislation prohibiting evictions and late fees during the time period for which the Mayor has declared a public health emergency, which is until at least May 15. The legislation also prohibits utility shutoffs.",1,Eviction Protection,https://ota.dc.gov/sites/default/files/dc/sites/ota/publication/attachments/2020.04.28%20%28FINAL%29%20OTA%20COVID-19%20and%20Tenant%20Rights-Resources.pdf,,Eviction Cases & Enforcement Suspended,"The DC Superior Court suspended landlord tenant and civil cases and stayed eviction and foreclosure cases until at least May 15. The D.C. Council passed emergency legisliation prohibiting filing and execution of evictions, foreclosures, and late fees during the time period for which the Mayor has declared a public health emergency. The legislation also prohibits utility shutoffs and requires a COVID-19 hardship alert on any consumer report. If a property has 5 or more units, property owners must offer tenants a payment plan program for past due rent and cannot report any tenant participating in the program to collections.",7.5,0,0,0,0,0,0,4,0,-0.5,4,USA
Guam,Guam,United States,State,13.4501257,144.757551029721,TRUE,"The Supreme Court of Guam has suspended all civil cases through 6/5/20. The Governor of Guam issued an emergency declaration prohibiting the initiation of any eviction or foreclosure actions involving real estate or property, whether rental or otherwise and tolled eviction and foreclosure actions currently in process for the duration of the public health emergency. The order does not clearly halt execution of past orders of eviction.",1,Eviction Protection,https://www.guam.gov/wpdev-content/uploads/2020/04/Executive-Order-2020-07-Relative-to-Establishing-a-Moratorium-on-Evictions-Clarifying-Price-Gouging-Prohibitions-and-Providing-for-Telephonic-Participation-in-Public-Meetings.pdf,,Eviction Cases & Enforcement Suspended,"The Supreme Court of Guam has suspended all civil cases through 6/5/20. The Governor of Guam issued an emergency declaration prohibiting the initiation of any eviction or foreclosure actions involving real estate or property, whether rental or otherwise and tolled eviction and foreclosure actions currently in process for the duration of the public health emergency. The order does not clearly halt execution of past orders of eviction.",2.5,0,0,0,0,0,0,2,0,0.5,0,USA
Northern Mariana Islands,Northern Mariana Islands,United States,State,14.1490205,145.213452483189,TRUE,"All civil trials are suspended and will be rescheduled after June 5. This should include evictions, although the order does not mention them explicitly.",1,,http://nmijudiciary.com/wp-content/uploads/2020/04/2020-ADM-0005-MSC-Order-No.-2-Re-COVID-19-corrected-2.pdf,,Civil Cases Suspended,"All civil trials are suspended and will be resecheduled after June 5. This should include evictions, although the order does not mention them explicitly.",4,0,0,0,0,0,0,2,0,2,0,USA
Virgin Islands,Virgin Islands,United States,State,18.4024395,-64.5661642,TRUE,Supreme Court of the Virgin Islands stayed all orders of eviction and foreclosure until 6/1/20. Filings are essential service and will continue to be allowed.,2,,https://www.vicourts.org/UserFiles/Servers/Server_9784218/File/News/2020/Admin%20Order%20-%20COVID%202020-002%20FINAL%20esig%20(002).pdf,,Eviction Cases & Enforcement Suspended,The Supreme Court of the Virgin Islands stayed all orders of eviction and foreclosure until 6/1/20. Filings are essential service and will continue to be allowed.,-1,0,0,0,0,0,0,2,0,-3,0,USA
Washington,Washington,United States,State,38.8949855,-77.0365708,TRUE,Governor has issued a temporary moratorium on all commerical and residential evictions and prohibits law enforcement from enforcing past orders of eviction. Provides an exception for cases where a landlord/owner can show that eviction is necessary for a public health or safety reason. Late fees cannot be assessed; rent cannot be raised until 6/4,1,Eviction Protection,https://www.governor.wa.gov/sites/default/files/20-19.1%20-%20COVID-19%20Moratorium%20on%20Evictions%20Extension%20%28tmp%29.pdf?utm_medium=email&utm_source=govdelivery,,Local Discretion,"The Governor of Washington issued a temporary moratorium on all commerical and residential evictions and prohibits law enforcement from enforcing past orders of eviction. The Governor's Proclamation provides an exception for cases where a landlord/owner can show that eviction is necessary for a public health or safety reason. Several cities and some counties took measures to expand on the Governor's original proclamation, but many of these orders have expired or will soon expire without extensions. The Governor's order also prohibits property owners from assessing late fees.",4.5,0,0,0,0,0,0,4,0,-3.5,4,USA
Simi Valley,California,United States,City,34.2694474,-118.781482,TRUE,"The city has placed a moratorium on evictions for non-payment of rent for tenants who can't afford to pay because of the pandemicâ€”for example, because their hours were cut, their business closed, they were laid off, or they have extreme medical costs related to COVID-19. To be protected, tenants have 30 days after rent is due to provide written notice to the landlord (including emails of texts) that they cannot pay rent, and must provide documentation to support their claim (such as pay stubs, time cards, proof of medical care or quarantine, or notices from employers or schools). Tenants are still required to pay rent.",2,Eviction Protection,https://www.cityofcamarillo.org/City%20Manager/Trending/3-18-20%20EOC%20Director%20Order%20No.%2020-2%20Staying%20Evictions.pdf,,Eviction Cases & Enforcement Suspended,"The Judicial Council of California adopted emergency rules preventing the issuance of summons and the entry of default in all foreclosure and eviction cases, including commercial, unless there is a threat to public health. The rules also postpone trials for at least 60 days. The Governor has issued an executive order banning the enforcement of eviction orders, and tolling response time for new eviction complaints, for renters affected by COVID-19 through May 31, 2020. This order still allows for local governments to pass their own stricter eviction bans. Since the Governor had previously issued an order giving local governments authority to halt evictions, slow foreclosures, and protect against utility shutoffs, several local governments have adopted coronavirus-specific eviction restrictions. Most of these require tenants to provide documentation to verify that they are unable to pay rent due to financial impacts related to COVID-19. Many county superior courts are tolling deadlines via emergency order.",0,0,0,0,0,0,0,2,0,-2,0,USA
Brasilia,DF,Brazil,Country,,,FALSE,"Foi proposto ontem (31/03/20) o projeto de lei n. 1179/2020, que se aprovado no congresso nacional, a lei irÃ¡ impedir que inquilinos sejam despejados (no caso de aÃ§Ãµes ingressadas a partir de 20/03/2020). Se aprovada, os proprietÃ¡rios deverÃ£o suspender os pagamentos totalmente ou de forma parcial. A lei, entretanto, possui protecoes fracas, uma vez que os locatÃ¡rios deverÃ£o comprovar junto ao proprietÃ¡rio que sofreram alguma alteraÃ§Ã£o financeira (ex. demissÃ£o, reduÃ§Ã£o salÃ¡rio, suspensÃ£o do contrato de trabalho...);
A suspensÃ£o dos aluguÃ©is com vencimento a partir de 20/03/2020 atÃ© o dia 30/10/2020 sera' aparada por lei federal.",,Federal Law,,,NA,,,,,,,,,,,,,BRA
Caracas,Caracas,Venezuela,County,,,TRUE,"Venezuela announces 6-month rent suspension, guarantees workersâ€™ wages, bans lay-offs https://www.peoplesworld.org/article/venezuela-announces-6-month-rent-suspension-guarantees-workers-wages-bans-lay-offs/",,National / Nacional,,,NA,,,,,,,,,,,,,VEN
Toronto,Ontario,Canada,State,,,TRUE,Provincial government obtained an order from the Ontario Superior Court of Justice suspending enforcement of all residential eviction orders except where owner/landlord brings an urgent motion to court demonstrating circumstances that outweigh the risk posed by the pandemic.,,Judicial / Orden judicial,,,NA,,,,,,,,,,,,,CAN
Toronto,Ontario,Canada,State,,,TRUE,"The Landlord and Tenant Board, Ontario's provincial housing tribunal, has suspended the issuance of all eviction orders, cancelled all eviction hearings, and will only process applications for eviction hearings in cases of serious alleged illegal acts or endangerment of safety.",,housing tribunal operations,,,NA,,,,,,,,,,,,,CAN
Beirut,Beirut,Lebanon,Country,33.854721,35.862286,TRUE,"A law to suspend payment deadlines have been passed from October to July. New rents are within these deadlines, however the law has severe shortcomings. First, it does not clarify what happens after July and does not include any mechanism for payments or possible exemptions; which would severely affect low and middle income dwellers amidst the worst economic crisis the country has witnessed. Second, it unjustly excludes old tenants from exemption, who are now subject to a new law that was issued in 2017 and that includes several deadlines that these tenants could not meet amidst the foreclosure due to COVID-19.",,National / Nacional,,,NA,,,,,,,,,,,,,LBN
Dublin,Dublin,Ireland,Country,,,TRUE,3 month ban on all evictions. Rent increase freeze. Increased social welfare payments and state subsidies for renters (rent supplements),,National / Nacional,,,NA,,,,,,,,,,,,,IRL
,,Argentina,Country,,,TRUE,Executive order to ban evictions (three months). Rents frozen and contracts are automatically renewed.,3,National,,,NA,,,,,,,,,,,,,ARG
,,Australia,Country,,,TRUE,Prime Minister announced that the States and Territories will be moving to put a six month moratorium on evictions under both commercial and residential leases if tenants encounter severe financial distress and are unable to meet their commitments.,3,National,,,NA,,,,,,,,,,,,,AUS
,Queensland,Australia,State,,,TRUE,The state government will begin a three-month freeze on land tax for property owners who agree to provide rent reductions.,3,State Government,,,NA,,,,,,,,,,,,,AUS
,,Austria,Country,,,TRUE,"Tenants can request that evictions are delayed, due to urgent need of housing. This may not be granted if landlords prove that they need the housing for themselves or would experience ""major economic disadvantages"". Rent for the months April, May, June can be paid later (until the end of the year), including a 4% interest rate. Contracts cannot be terminated for not paying rent during these three months. Also, landlords cannot go to court until the end of the year to get the rent for these months. If a temporary contract ends between 30 March and 1 July 2020, tenants can request a one-time extension until the end of the year or also shorter. Landlords can, however, refuse to grant an extension. Rent for businesses: based on pre-existing legislation in Austria rent for businesses can be reduced or suspended altogether if a business property canâ€™t be used normally due to â€˜extraordinary hazardsâ€™. Courts may decide on a case-by-case basis. The Austrian association of non-profit subsidized housing providers has announced that additional to a temporary stop of evictions caused by Corona-linked financial difficulties, tenants can also expect suspension and delays of their rental payments if needed. This is done on a case-by-case basis and there are no binding legal rights.",3,National,,,NA,,,,,,,,,,,,,AUT
Vienna,,Austria,City,48.2082,16.3738,TRUE,"The Vienna council housing (public housing) department has put a moratorium on evictions in the council housing sector. // The City of Vienna has simplified procedures to access housing benefits for tenants. For a limited time period of six months tenants can access benefits without submitting a (new) application. // Vienna's municipal housing company 'Wiener Wohnen' announces it's suspending evictions until 10 April 2020.  Vienna municipality prepared a care centre for 880 patients at Messe Wien to provide enough beds for the sick if necessary. The service will be open for homeless people as well.  Emergency shelters are to remain open 24 hours, but day centres have limited their capacities to secure social distancing. Vienna's local authorities have appealed for a stop of evictions due to the coronavirus crisis.",3,City Council,,,NA,,,,,,,,,,,,,AUT
Brussels,,Belgium,City,50.846557,4.351697,TRUE,"The Hotel President in Schaerbeek will be used to host families, which are currently accommodated in a Samusocial centre in Evere. The hotel can host 320 (not infected) persons and has a garden where children can play. Four Brussels municipalities (Forest, Ixelles, St. Gilles and St.Josse/Schaerbeek) requisitioned hotels to host homeless people.  Brussels municipality opens 15 confinment spaces for homeless infected by coronavirus at centre managed by the Red Cross. Brussels municipality announces 7.1m euros for those assisting vulnerable people, including the homeless. In the European Parliament premises in Brussels, two spaces will be created inside one of its buildings. One for the homeless, and another for those who leave the hospital but still cannot return home.",3,,,,NA,,,,,,,,,,,,,BEL
La LouviÃ¨re,,Belgium,City,50.479487,4.185268,TRUE,The social public centre to run 6 places where the homeless with Covid-19 symptoms can be confined.,3,,,,NA,,,,,,,,,,,,,BEL
Mons,,Belgium,City,50.454957,3.951958,TRUE,"The social public centre and the municipality agree to host the homeless at the Tondreau football stadium, where they can also use the showers.",2,,,,NA,,,,,,,,,,,,,BEL
,,Belgium,Country,,,TRUE,"All Belgian regions have suspended evictions until at least April 5 (17/03 Brussels, 18/03 Wallonia, 20/03 Flanders; The federal government grants a subsidy to the cities of Ghent, Antwerp, LiâˆšÂ®ge and Charleroi of in a total of 200,000 euro to give them the opportunity to open up places where sick homeless people can be housed in a safe and isolated way.  Those financially suffering from the COVID-19 crisis can pause their mortgage payments until the end of October, conditions apply.",3,National,,,NA,,,,,,,,,,,,,BEL
,MaranhÃ£o,Brazil,State,,,TRUE,"Federal Resolution nÂ°11, 3/26/2020, suspends evictions of Quilombola communities in MranahÃ£o State, during the covid-crisis.",3,National,,,NA,,,,,,,,,,,,,BRA
Sofia,,Bulgaria,City,42.697863,23.322179,FALSE,The crisis centre for the homeless is not accepting any more people nor is it letting those inside leave.,1,,,,NA,,,,,,,,,,,,,BGR
,British Columbia,Canada,State,,,TRUE,B.C. is suspending evictions and freezing rent increases in an effort to help tenants make ends meet and keep their homes for the duration of the provincial COVID-19 emergency. The government is also offering a monthly rebate of up to $500 for three months to take some pressure off tenants struggling to make payments. Landlords are also getting $500 to help offset lack of rents.,3,National,,,NA,,,,,,,,,,,,,CAN
,QuÃ©bec,Canada,State,,,TRUE,Evictions are suspended,2,Provincial,,,NA,,,,,,,,,,,,,CAN
,Ontario,Canada,State,,,TRUE,"No new eviction orders will be issued by the court, and sheriffs will postpone any schedule eviction removals. Landlords can still give eviction notices but the board that reviews them has suspended all hearings until further notice ""except for urgent disputes such as those involving illegal acts or serious safety concerns."" Sheriffs will not enfoce new eviction notices.",2,Court Order,,,NA,,,,,,,,,,,,,CAN
,Saskatchewan,Canada,State,,,TRUE,Evictions are suspended,2,Provincial,,,NA,,,,,,,,,,,,,CAN
,Manitoba,Canada,State,,,TRUE,"Postpones non-urgent eviction hearings, freezes rent increases",2,Provincial,,,NA,,,,,,,,,,,,,CAN
,Alberta,Canada,State,,,TRUE,"Suspended evictions for non-payment of rent or utilities, froze rent increases",3,Provincial,,,NA,,,,,,,,,,,,,CAN
,Prince Edward Island,Canada,State,,,TRUE,"Suspended evictions, implemented retal assistance benefits",3,Provincial,,,NA,,,,,,,,,,,,,CAN
,New Brunswick,Canada,State,,,TRUE,Suspended evictions until May 31,2,Provincial,,,NA,,,,,,,,,,,,,CAN
,Nova Scotia,Canada,State,,,TRUE,Suspended evictions for 3 months,2,Provincial,,,NA,,,,,,,,,,,,,CAN
,Newfoundland and Labrador,Canada,State,,,TRUE,Evictions are suspended,2,Provincial,,,NA,,,,,,,,,,,,,CAN
,Labrador,Canada,State,,,TRUE,Evictions are suspended,2,Provincial,,,NA,,,,,,,,,,,,,CAN
,Yukon,Canada,State,,,TRUE,Banned evictions for non-payment of rent,2,Provincial,,,NA,,,,,,,,,,,,,CAN
,Northwest Territories,Canada,State,,,TRUE,"Tenants can defer rent payments, no evictions",2,Provincial,,,NA,,,,,,,,,,,,,CAN
,Nunavut,Canada,State,,,FALSE,,1,Provincial,,,NA,,,,,,,,,,,,,CAN
,,Croatia,Country,,,TRUE,Prime Minister Andrej Plenkovic says there will not be foreclosures and evictions during the coronavirus crisis.,2,National,,,NA,,,,,,,,,,,,,HRV
Brno,,Czech Republic,City,49.192244,16.611338,FALSE,Brno Social Welfare Department: 'We are aware that there may be a moment when someone from the homeless community is quarantined. Of course we are looking for a way to put them in isolation'.,1,Municipal,,,NA,,,,,,,,,,,,,CZE
Prague,,Czech Republic,City,50.087465,14.421254,FALSE,"Prague municipality is considering housing the homeless in 'crisis apartments' so that they too can follow the restrictions imposed on the population by the government. On 20 March 2020, the 'winter season' was over and some accommodation for the homeless reduced their services.",2,Municipal,,,NA,,,,,,,,,,,,,CZE
,,Czech Republic,Country,,,TRUE,"The Ministry of Labour and Social Affairs publishes guidelines: extending dormitory hours 24/7, and refusal of the homeless to have the temperature taken may be a reason for refusing to provide them with social services.""The Moratorium on the repayment of loans and mortgages in the Czech Republic proposed on April 2, 2020 is binding for all banks and non-bank lenders. Both private and business debtors will be able to suspend their repayments for three or six months, based on their choice.""",3,Ministerial,,,NA,,,,,,,,,,,,,CZE
Aarhus,,Denmark,City,56.149628,10.213405,TRUE,"Aarhus municipality to preemptively set up 13 places (10 for adults and 3 for children) in case they need to quarantine the homeless. The 'winter hostel', run by the municipality and several charities, is to remain open until the end of April instead of closing now at the beginning of spring. Aarhus Municipality and Central Denmark Region have teamed up to test the homeless and vulnerable. The tests are done by medical students, and in Aarhus there will be the possibility of tests twice a week.",3,Municipal,,,NA,,,,,,,,,,,,,DNK
Copenhagen,,Denmark,City,55.686724,12.570072,TRUE,"The BaunehÃ¸jhallen sports facility in Sydhavnen has been transformed into an emergency shelter with 50 beds for the homeless. Copenhagen municipality to prepare extra places at a â€˜hostelâ€™ and has rented a â€˜large old nursing homeâ€™ to quarantine the homeless who are infected. In Copenhagen, schemes have now been set up to test all the homeless and vulnerable who want.",2,Municipal,,,NA,,,,,,,,,,,,,DNK
,,Denmark,Country,,,TRUE,The Danish Ministry of Social Affairs states that municipalities are obliged to provide the homeless with all the necessary services during the coronavirus crisis.,2,Ministerial,,,NA,,,,,,,,,,,,,DNK
,,El Salvador,Country,,,TRUE,Three-month suspensions on loan repayments and utility payments,2,National,,,NA,,,,,,,,,,,,,SLV
Helsinki,,Finland,City,60.16741,24.942577,TRUE,Helsinki municipality says it'll ensure that emergency accommodation for the homeless is provided. The Hietaniemi service centre (52 bed places) is open and also another emergency unit which is normally reserved for Roma people at the Helsinki Diaconate Institute is open for homeless people (there are now less Roma people in Helsinki).,3,Municipal,,,NA,,,,,,,,,,,,,FIN
