municipality,state,Country,admin_scale,lat,lng,passed,policy_summary,range,policy_type,link,resource,state_level_legal_status,state_level_legal_summary,point_total,pts_eviction_initiation_tot_10,pts_eviction_protect_tot_04,pts_eviction_pending_tot_03,pts_tenant_action_tot_00,pts_partial_rent_tot_01,pts_repayment_period_tot_05,pts_latefees_tot_03,pts_repayment_plan_tot_00,pts_courts_tot_15,pts_renter_protection_tot_06,ISO
Fremont,California,United States,City,37.5482697,-121.9885719,TRUE,A temporary moratorium on evictions of residential tenants.,2,Eviction Protection,https://www.fremont.gov/3599/Temporary-Moratorium-on-Evictions,https://actionnetwork.org/letters/fremont-eviction-moratorium-during-covid-19-coronavirus-crisis/,Eviction Cases & Enforcement Suspended,"The Judicial Council of California adopted emergency rules preventing the issuance of summons and the entry of default in all foreclosure and eviction cases, including commercial, unless there is a threat to public health. The rules also postpone trials for at least 60 days. The Governor has issued an executive order banning the enforcement of eviction orders, and tolling response time for new eviction complaints, for renters affected by COVID-19 through May 31, 2020. This order still allows for local governments to pass their own stricter eviction bans. Since the Governor had previously issued an order giving local governments authority to halt evictions, slow foreclosures, and protect against utility shutoffs, several local governments have adopted coronavirus-specific eviction restrictions. Most of these require tenants to provide documentation to verify that they are unable to pay rent due to financial impacts related to COVID-19. Many county superior courts are tolling deadlines via emergency order.",-1,0,0,0,0,-3,0,4,-1,-2,1,USA
San Bernadino,California,United States,City,34.0566777,-117.19886100098,TRUE,,2,Eviction Protection,http://www.sbcity.org/documents/CM%20Executive%20Order%20No.%202020-01%20Moratorim%20on%20Housing%20Displacement%203-20-2020.pdf,,Eviction Cases & Enforcement Suspended,"The Judicial Council of California adopted emergency rules preventing the issuance of summons and the entry of default in all foreclosure and eviction cases, including commercial, unless there is a threat to public health. The rules also postpone trials for at least 60 days. The Governor has issued an executive order banning the enforcement of eviction orders, and tolling response time for new eviction complaints, for renters affected by COVID-19 through May 31, 2020. This order still allows for local governments to pass their own stricter eviction bans. Since the Governor had previously issued an order giving local governments authority to halt evictions, slow foreclosures, and protect against utility shutoffs, several local governments have adopted coronavirus-specific eviction restrictions. Most of these require tenants to provide documentation to verify that they are unable to pay rent due to financial impacts related to COVID-19. Many county superior courts are tolling deadlines via emergency order.",2,0,0,0,0,-1,0,4,0,-2,1,USA
Illinois,Illinois,United States,State,40.0796606,-89.4337288,TRUE,,2,,https://www2.illinois.gov/Pages/Executive-Orders/ExecutiveOrder2020-30.aspx,,Eviction Enforcement Suspended,"The Governor of Illinois issued an ""order ceasing evictions"" that stated: ""all state, county and local law enforcement officers in the State of Illinois are instructed to cease enforcement of orders of eviction for residential premises for the duration of the Gubernatorial Disaster Proclamation."" The State Supreme Court has directed lower courts to keep fulfilling essential functions, but to delay or schedule remote hearings for non-essential matters. Local courts may also suspend deadlines.",-0.5,0,0,0,0,0,0,2,0,-2.5,0,USA
Chicago,Illinois,United States,City,41.8755616,-87.6244212,FALSE,"#RentFreezeNow calls for an indefinite freeze on collection of all rent, mortgage, and utility payments throughout the duration of the crisis. The freeze must operate as a waiver of payments, not a deferral in which people will find themselves saddled by debt after the crisis. Additionally, for the Circuit Court to close all court filings for evictions and foreclosures, for the city to house residents experiencing homelessness immediately, and for landlords and/or city officials to grant automatic lease extensions to tenants unable to move during the crisis.",2,,https://actionnetwork.org/petitions/rent-freeze-in-chicago-now?hash=6db78e6bab0bb6933651ba22d4fbfe95,,Eviction Enforcement Suspended,"The Governor of Illinois issued an ""order ceasing evictions"" that stated: ""all state, county and local law enforcement officers in the State of Illinois are instructed to cease enforcement of orders of eviction for residential premises for the duration of the Gubernatorial Disaster Proclamation."" The State Supreme Court has directed lower courts to keep fulfilling essential functions, but to delay or schedule remote hearings for non-essential matters. Local courts may also suspend deadlines.",-0.5,0,0,0,0,0,0,2,0,-2.5,0,USA
Mountain View,California,United States,City,37.3893889,-122.0832101,TRUE,,2,Eviction Protection,https://www.mountainview.gov/civicax/filebank/blobdload.aspx?BlobID=32122,,Eviction Cases & Enforcement Suspended,"The Judicial Council of California adopted emergency rules preventing the issuance of summons and the entry of default in all foreclosure and eviction cases, including commercial, unless there is a threat to public health. The rules also postpone trials for at least 60 days. The Governor has issued an executive order banning the enforcement of eviction orders, and tolling response time for new eviction complaints, for renters affected by COVID-19 through May 31, 2020. This order still allows for local governments to pass their own stricter eviction bans. Since the Governor had previously issued an order giving local governments authority to halt evictions, slow foreclosures, and protect against utility shutoffs, several local governments have adopted coronavirus-specific eviction restrictions. Most of these require tenants to provide documentation to verify that they are unable to pay rent due to financial impacts related to COVID-19. Many county superior courts are tolling deadlines via emergency order.",-1.5,0,0,0,0,-1,0,2,-0.5,-2,0,USA
Michigan,Michigan,United States,State,43.6211955,-84.6824346,TRUE,"Tenants and mobile home owners to remain in their homes during the COVID-19 pandemic even if they are unable to stay current on their rent. The order also relieves courts from certain statutory restrictions to enable them to stay eviction-related proceedings until after the COVID-19 emergency has passed. The executive order takes effect immediately and will remain in effect until July 25, 2020.",3,,https://courts.michigan.gov/Courts/MichiganSupremeCourt/rules/court-rules-admin-matters/Administrative%20Orders/2020-08_2020-04-16_FormattedOrder_AO2020-8.pdf,,Eviction Cases Suspended,"Governor Gretchen Whitmer's order suspends service of process and execution of eviction orders unless the tenant poses a ""risk to another person or an imminent and severe risk to property."" Michigan's courts may still hear existing civil cases remotely. Court deadlines and deadlines to commence civil actions are tolled. Property owners must submit verification that the property is exempt from the federal CARES Act moratorium.",-3.5,0,0,0,0,0,0,2,0,-5.5,0,USA
East Palo Alto,California,United States,City,37.4688273,-122.1410751,TRUE,Ordinance Establishing a Temporary Moratorium on Eviction for Non-Payment of Rent by Residential Tenants Directly Impacted by the COVID-19 Pandemic,2,Eviction Protection,http://eastpaloalto.iqm2.com/Citizens/Detail_Meeting.aspx?ID=1076,,Eviction Cases & Enforcement Suspended,"The Judicial Council of California adopted emergency rules preventing the issuance of summons and the entry of default in all foreclosure and eviction cases, including commercial, unless there is a threat to public health. The rules also postpone trials for at least 60 days. The Governor has issued an executive order banning the enforcement of eviction orders, and tolling response time for new eviction complaints, for renters affected by COVID-19 through May 31, 2020. This order still allows for local governments to pass their own stricter eviction bans. Since the Governor had previously issued an order giving local governments authority to halt evictions, slow foreclosures, and protect against utility shutoffs, several local governments have adopted coronavirus-specific eviction restrictions. Most of these require tenants to provide documentation to verify that they are unable to pay rent due to financial impacts related to COVID-19. Many county superior courts are tolling deadlines via emergency order.",2,0,0,0,0,-1,0,4,0,-2,1,USA
Collin County,Texas,United States,County,33.1609629,-96.6060984,TRUE,"Due to COVID-19 Collin County Justice Courts issued an order stating that no eviction settings (both residential and commercial) will be held until after May 8, 2020. No writs
of possession will be issued by a Justice Court until May 8, 2020.",2,,https://www.collincountytx.gov/justices_peace/Documents/COVID-19%20Order%2001.pdf,,Eviction Cases & Enforcement Suspended,"The Texas Supreme Court has suspended all eviction proceedings and hearings until 4/30/20. New filings are accepted but issuances of service and citation may not occur until 4/30/20. Execution of writ of possessions may be issued but the written warning and execution may not occur until after 5/7/20 However, there are limited exceptions, evictions can proceed if the occupants ""are engaging in criminal activity"" or ""pose an imminent physical threat.""",-1,0,0,0,0,0,0,2,0,-3,0,USA
New Hampshire,New Hampshire,United States,State,43.4849133,-71.6553992,TRUE,The governor has placed a moratorium on all evictions and foreclosures. Landlords who violate this order can be subject to penalties. Tenants are still required to pay rent aned homeowners are still required to make mortgage payments.,2,Eviction Protection,https://www.governor.nh.gov/news-media/press-2020/documents/emergency-order-4.pdf,http://granitestateorganizing.org/covid-19-resources/,Eviction Cases & Enforcement Suspended,The Governor's office signed an emergency order halting eviction and foreclosure proceedings during the crisis. The order excludes evictions for lease or law violations that result in substantial damage to the property or substantial adverse impact on the health and safety of other persons. It does not apply to abandonement. It preempts any local orders.,-2,0,0,0,0,0,0,2,-0.5,-3.5,0,USA
Texas,Texas,United States,State,31.8160381,-99.5120986,TRUE,,2,,https://www.txcourts.gov/media/1446315/209051.pdf,,Eviction Cases & Enforcement Suspended,"The Texas Supreme Court has suspended all eviction proceedings and hearings until 4/30/20. New filings are accepted but issuances of service and citation may not occur until 4/30/20. Execution of writ of possessions may be issued but the written warning and execution may not occur until after 5/7/20 However, there are limited exceptions, evictions can proceed if the occupants ""are engaging in criminal activity"" or ""pose an imminent physical threat.""",-1,0,0,0,0,0,0,2,0,-3,0,USA
Solano County,California,United States,County,38.2218938,-121.9163555,TRUE,,2,Eviction Protection,https://www.dailyrepublic.com/all-dr-news/solano-news/fairfield/solano-supervisors-to-consider-moratorium-on-evictions-due-to-covid-19/,,Eviction Cases & Enforcement Suspended,"The Judicial Council of California adopted emergency rules preventing the issuance of summons and the entry of default in all foreclosure and eviction cases, including commercial, unless there is a threat to public health. The rules also postpone trials for at least 60 days. The Governor has issued an executive order banning the enforcement of eviction orders, and tolling response time for new eviction complaints, for renters affected by COVID-19 through May 31, 2020. This order still allows for local governments to pass their own stricter eviction bans. Since the Governor had previously issued an order giving local governments authority to halt evictions, slow foreclosures, and protect against utility shutoffs, several local governments have adopted coronavirus-specific eviction restrictions. Most of these require tenants to provide documentation to verify that they are unable to pay rent due to financial impacts related to COVID-19. Many county superior courts are tolling deadlines via emergency order.",-0.5,0,0,0,0,0,0,2,-0.5,-2,0,USA
Dallas County,Texas,United States,County,32.7620405,-96.7790069,TRUE,"Advises the Dallas County Justices of the Peace to suspend eviction hearings
and writs of possession for at least the next 60 days to prevent renters from
being displaced and to prevent the potential spread of COVID-19.",2,,https://www.dallascounty.org/Assets/uploads/docs/judge-jenkins/covid-19/March18-AmendedOrder-SummaryofChanges.pdf,,Eviction Cases & Enforcement Suspended,"The Texas Supreme Court has suspended all eviction proceedings and hearings until 4/30/20. New filings are accepted but issuances of service and citation may not occur until 4/30/20. Execution of writ of possessions may be issued but the written warning and execution may not occur until after 5/7/20 However, there are limited exceptions, evictions can proceed if the occupants ""are engaging in criminal activity"" or ""pose an imminent physical threat.""",-1,0,0,0,0,0,0,2,0,-3,0,USA
Marin County,California,United States,County,38.0409144,-122.6199638,TRUE,,1,Eviction Protection,https://www.marincounty.org/-/media/files/departments/cd/housing/landlord-and-tenant-resources/r202027complete-accessible.pdf?la=en,,Eviction Cases & Enforcement Suspended,"The Judicial Council of California adopted emergency rules preventing the issuance of summons and the entry of default in all foreclosure and eviction cases, including commercial, unless there is a threat to public health. The rules also postpone trials for at least 60 days. The Governor has issued an executive order banning the enforcement of eviction orders, and tolling response time for new eviction complaints, for renters affected by COVID-19 through May 31, 2020. This order still allows for local governments to pass their own stricter eviction bans. Since the Governor had previously issued an order giving local governments authority to halt evictions, slow foreclosures, and protect against utility shutoffs, several local governments have adopted coronavirus-specific eviction restrictions. Most of these require tenants to provide documentation to verify that they are unable to pay rent due to financial impacts related to COVID-19. Many county superior courts are tolling deadlines via emergency order.",3,0,0,0,0,0,0,4,0,-2,1,USA
Anaheim,California,United States,City,33.8347516,-117.911732,TRUE,,2,Eviction Protection,https://www.anaheim.net/DocumentCenter/View/30818/Eviction-Moratorium-Fact-Sheet-3-24-20-English-and-Spanish,,Eviction Cases & Enforcement Suspended,"The Judicial Council of California adopted emergency rules preventing the issuance of summons and the entry of default in all foreclosure and eviction cases, including commercial, unless there is a threat to public health. The rules also postpone trials for at least 60 days. The Governor has issued an executive order banning the enforcement of eviction orders, and tolling response time for new eviction complaints, for renters affected by COVID-19 through May 31, 2020. This order still allows for local governments to pass their own stricter eviction bans. Since the Governor had previously issued an order giving local governments authority to halt evictions, slow foreclosures, and protect against utility shutoffs, several local governments have adopted coronavirus-specific eviction restrictions. Most of these require tenants to provide documentation to verify that they are unable to pay rent due to financial impacts related to COVID-19. Many county superior courts are tolling deadlines via emergency order.",1,0,0,0,0,-1,0,4,-1,-2,1,USA
Arizona,Arizona,United States,State,34.395342,-111.7632755,TRUE,"Governor Ducey signed Executive Order 2020-14, titled â€œPostponement of Eviction Actions,â€
which permits tenants to delay removal from their residence by the constable or a law
enforcement officer beginning March 24, 2020 if the tenant provides the landlord written notice
of a qualifying circumstance that exists at the time of the notice.",2,,https://www.azcourts.gov/Portals/34/20200429EvictionGuidanceFinal.pdf,,COVID-19 Related Eviction Cases Suspended,"The Governor has issued a stay on executing all evictions statewide for tenants who can show 1) that they have suffered a substantial loss of income due to COVID-19, 2) that they or a family member have been ordered to stay in quarantine by a medical professional, or 3) that they have a health condition that makes them more at risk to COVID-19. Evictions proceedings are managed by each Superior Court at the local level. So while evictions actions can't be executed, they can still be filed and managed in court. However, Mohave County Court has allowed judges to delay eviction cases if needed. In Phoenix, all city-owned housing is prohibited from evicting tenants. The state supreme court has tolled all eviction deadlines to 5/1/20.",-1.5,0,0,0,0,0,0,2,0,-3.5,0,USA
Franklin County,Ohio,United States,County,40.0283162,-83.0076657,TRUE,,1,,http://www.fcmcclerk.com/documents/court/2020-4-6_Administrative%20Order%2007-2020.pdf,,Local Discretion,"The Supreme Court of Ohio tolled all court deadlines until the earlier of the end of the emergency or 7/30/20. The court also issued guidance (as opposed to an order) to local courts that suggested courts could temporarily continue eviction filings, pending eviction proceedings, scheduled move-outs, and the execution of foreclosure judgements (except in the instances where allegations of domestic violence are involved). However, the determination of how to restrict access to the court is left to local jurisdiction. Several municipal courts have ordered the suspension of evictions. Both the governor and the Supreme Court recently issued orders tolling court deadlines; in its guidance as to how this applies to evictions, the Supreme Court states, ""Nothing in the legislation or the Supreme Court’s order prevents the filing of an eviction action during the emergency period."" The Governor issued an emergency order ""requesting"" that landlords of commercial properties suspend rent payments and evictions and that lenders provide mortgage forbearance.",6,0,0,0,0,0,0,2,0,4,0,USA
Sioux Falls,South Dakota,United States,City,43.5499749,-96.700327,FALSE,"The One Sioux Falls Fund was created to help local residents negatively impacted by COVID-19 in the Sioux Falls area. The fund is set up in collaboration with the Sioux Falls Area Community Foundation. The goal of the fund is to help residents in the Sioux Falls MSA (Minnehaha, Lincoln, McCook and Turner counties) avoid evictions and financial hardships if they are unable to work due to COVID-19 and if they are unable to qualify for federal or state assistance. Applicants will be required to demonstrate financial impact with appropriate documentation.",2,Renter Relief,https://www.siouxfalls.org/news/2020/03/17/relief-fund,,Local Discretion,"The Supreme Court of the State of South Dakota declared a judicial emergency and authorized circuit courts to adoopt, modify or suspend court rules to prevent the spread of COVID-19. None of the circuit court orders suspend evictions or civil proceedings generally. The Governor has explicitly stated that she will not consider an eviction or utility shutoff moratorium. One of South Dakota's largest utilities provider has implemented a moratorium on service disconnections for nonpayment, as have the cities of Brookings, Rapid City and Sioux Falls. Finally, the city of Sioux Falls has established a fund to help residents adversely affected by COVID-19; the Sioux Falls Metropolitan Statistical Area (Minnehaha, Lincoln, McCook and Turner counties) has done similarly, to help residents avoid ""evictions and financial hardships.""",1.5,0,0,0,0,0,0,2,0,-0.5,0,USA
Atlanta,Georgia,United States,City,33.7490987,-84.3901849,TRUE,"The mayor issued this order to the Atlanta Housing Authority, Atlanta Beltline, Fulton County/City of Atlanta Land Bank Authority, Invest Atlanta, Partners for Home, and the city's Department of Grants and Community Development.",2,Eviction Protection,https://www.atlantaga.gov/Home/ShowDocument?id=45422,,Local Discretion,"Georgia's Supreme Court has issued guidance that courts are to prioritize essential functions from March 14, 2020 to April 13th, 2020 and conduct video proceedings wherever possible. Each circuit, municipal and magistrate court had a slightly different version and date range for adopting this ruling.",1,0,0,0,0,0,0,2,0,-1,0,USA
Virginia,Virginia,United States,State,37.1232245,-78.4927721,TRUE,,2,,http://www.vacourts.gov/news/items/covid/2020_0422_scv_order_extending_declaration_of_judicial_emergency.pdf,,Eviction Cases Suspended,"The Supreme Court of Virginia continued all eviction proceedings until April 26, 2020. The Governor directed state agencies to assist Virginians in avoiding evictions and foreclosures. The Attorney General has sent warning letters to landlords thretening to evict tenants during the COVID-19 pandemic.",2,0,0,0,0,0,0,2,0,0,0,USA
Richmond,California,United States,City,37.9357576,-122.3477486,TRUE,"The city has placed a moratorium on all no-fault evictions, except those deemed necessary for health and safety, and on evictions for non-payment of rent for tenants who have lost income because of the pandemicâ€”for example, because their hours were cut, their business closed, they were laid off, or they have extreme medical costs related to COVID-19.",2,Eviction Protection,http://www.ci.richmond.ca.us/DocumentCenter/View/52484/20-20-reso-temporary-moratorium-on-evictions-for-non-payment---COVID-19---Issued-3-17-2020,,Eviction Cases & Enforcement Suspended,"The Judicial Council of California adopted emergency rules preventing the issuance of summons and the entry of default in all foreclosure and eviction cases, including commercial, unless there is a threat to public health. The rules also postpone trials for at least 60 days. The Governor has issued an executive order banning the enforcement of eviction orders, and tolling response time for new eviction complaints, for renters affected by COVID-19 through May 31, 2020. This order still allows for local governments to pass their own stricter eviction bans. Since the Governor had previously issued an order giving local governments authority to halt evictions, slow foreclosures, and protect against utility shutoffs, several local governments have adopted coronavirus-specific eviction restrictions. Most of these require tenants to provide documentation to verify that they are unable to pay rent due to financial impacts related to COVID-19. Many county superior courts are tolling deadlines via emergency order.",2,0,0,0,0,-1,0,4,0,-2,1,USA
Los Angeles County,California,United States,County,34.3155072,-118.2096814,TRUE,,2,Eviction Protection,http://file.lacounty.gov/SDSInter/bos/supdocs/145198.pdf,,Eviction Cases & Enforcement Suspended,"The Judicial Council of California adopted emergency rules preventing the issuance of summons and the entry of default in all foreclosure and eviction cases, including commercial, unless there is a threat to public health. The rules also postpone trials for at least 60 days. The Governor has issued an executive order banning the enforcement of eviction orders, and tolling response time for new eviction complaints, for renters affected by COVID-19 through May 31, 2020. This order still allows for local governments to pass their own stricter eviction bans. Since the Governor had previously issued an order giving local governments authority to halt evictions, slow foreclosures, and protect against utility shutoffs, several local governments have adopted coronavirus-specific eviction restrictions. Most of these require tenants to provide documentation to verify that they are unable to pay rent due to financial impacts related to COVID-19. Many county superior courts are tolling deadlines via emergency order.",0.5,0,0,0,0,0,0,4,-0.5,-2,-1,USA
Little Rock,Arkansas,United States,City,34.7464809,-92.2895948,TRUE,The Metropolitan Housing Alliance has announced that public housing residents and Section 8 tenants in Little Rock will not be evicted during this time period. The housing agency will work with property management companies on rent forbearance. The housing agency is also not terminating anyone using Section 8 vouchers for housing.,2,Eviction Protection,https://www.nwaonline.com/news/2020/mar/18/lr-agency-won-t-evict-public-housing-te/,,Civil Cases Suspended,"Arkansas has suspended all in-person proceedings, subject to exceptions that don't include eviction, but has urged judges to conduct matters that they can remotely.",-0.5,0,0,0,0,0,0,2,0,-2.5,0,USA
