municipality,state,Country,admin_scale,lat,lng,passed,policy_summary,range,policy_type,link,resource,state_level_legal_status,state_level_legal_summary,point_total,pts_eviction_initiation_tot_10,pts_eviction_protect_tot_04,pts_eviction_pending_tot_03,pts_tenant_action_tot_00,pts_partial_rent_tot_01,pts_repayment_period_tot_05,pts_latefees_tot_03,pts_repayment_plan_tot_00,pts_courts_tot_15,pts_renter_protection_tot_06,ISO
Newark,California,United States,City,37.5296593,-122.0402399,TRUE,,2,Eviction Protection,https://www.newark.org/home/showdocument?id=5815,https://actionnetwork.org/letters/newark-eviction-moratorium-during-covid-19-coronavirus-crisis/,Eviction Cases & Enforcement Suspended,"The Judicial Council of California adopted emergency rules preventing the issuance of summons and the entry of default in all foreclosure and eviction cases, including commercial, unless there is a threat to public health. The rules also postpone trials for at least 60 days. The Governor has issued an executive order banning the enforcement of eviction orders, and tolling response time for new eviction complaints, for renters affected by COVID-19 through May 31, 2020. This order still allows for local governments to pass their own stricter eviction bans. Since the Governor had previously issued an order giving local governments authority to halt evictions, slow foreclosures, and protect against utility shutoffs, several local governments have adopted coronavirus-specific eviction restrictions. Most of these require tenants to provide documentation to verify that they are unable to pay rent due to financial impacts related to COVID-19. Many county superior courts are tolling deadlines via emergency order.",1,0,0,0,0,-1,0,4,-1,-2,1,USA
San Mateo County,California,United States,County,37.496904,-122.3330573,TRUE,The San Mateo County Board of Supervisors unanimously enacted an emergency eviction moratorium to temporarily protect tenants from being displaced from their homes during the ongoing COVID-19 public health crisis. Protects eligible tenants against COVID-19 related nonpayment of rent and no-fault evictions. Tenants must inform landlords of non-payment and provide documentation within 14 days after landlord gives written notice of tenants' right to make a delayed payment. Tenants must offer supporting documentation to show they cannot pay the amount of rent due because they were impacted by COVID-19. They will have 90-180 days after the declaration of a public health emergency has ended to pay back the full amount of rent owed.,2,Eviction Protection,https://drive.google.com/a/berkeley.edu/file/d/16Ma_D7BJXWj2dEP9IjMXEtDgoK5YUiNn/view?usp=sharing,,Eviction Cases & Enforcement Suspended,"The Judicial Council of California adopted emergency rules preventing the issuance of summons and the entry of default in all foreclosure and eviction cases, including commercial, unless there is a threat to public health. The rules also postpone trials for at least 60 days. The Governor has issued an executive order banning the enforcement of eviction orders, and tolling response time for new eviction complaints, for renters affected by COVID-19 through May 31, 2020. This order still allows for local governments to pass their own stricter eviction bans. Since the Governor had previously issued an order giving local governments authority to halt evictions, slow foreclosures, and protect against utility shutoffs, several local governments have adopted coronavirus-specific eviction restrictions. Most of these require tenants to provide documentation to verify that they are unable to pay rent due to financial impacts related to COVID-19. Many county superior courts are tolling deadlines via emergency order.",0,0,0,0,0,-3,0,4,0,-2,1,USA
Santa Fe,New Mexico,United States,City,35.6869996,-105.9377997,TRUE,,2,Eviction Protection,https://www.santafenm.gov/news/detail/clarification_to_prohibit_eviction_of_tenants,,Eviction Enforcement Suspended,"The New Mexico Supreme Court has stayed the execution of writs of restitution for nonpayment of rent under NMSA 1978, Section 47-8-46 (A) if the resident has demonstrated by a preponderance of the evidence a current inability to pay rent. The New Mexico Supreme Court has also stayed the execution of writs of restitution for mobile homes. Two major cities in New Mexico have taken action: (1) Santa Fe: The mayor has placed a moratorium on evictions for non-payment of rent for tenants who can't afford to pay because of the pandemic. Water shut-offs are also banned. Collection of lodger’s taxes has been delayed, and all public buses are free; (2) Albuquerque: All evictions from city-owned properties are suspended.",-2.5,0,0,0,0,0,0,2,-0.5,-4,0,USA
Santa Barbara,California,United States,City,34.4221319,-119.7026673,TRUE,"This is a temporary moratorium on evictions for tenants who experienced loss of income due to COVID-19. Landlords cannot eviction tenants due to COVID-19 related burdens. City tenants must provide documentation, for example, demonstrating that their failure to pay rent is due to the virus.",2,Eviction Protection,http://countyofsb.org/housing/UrgencyOrdinance.sbc,,Eviction Cases & Enforcement Suspended,"The Judicial Council of California adopted emergency rules preventing the issuance of summons and the entry of default in all foreclosure and eviction cases, including commercial, unless there is a threat to public health. The rules also postpone trials for at least 60 days. The Governor has issued an executive order banning the enforcement of eviction orders, and tolling response time for new eviction complaints, for renters affected by COVID-19 through May 31, 2020. This order still allows for local governments to pass their own stricter eviction bans. Since the Governor had previously issued an order giving local governments authority to halt evictions, slow foreclosures, and protect against utility shutoffs, several local governments have adopted coronavirus-specific eviction restrictions. Most of these require tenants to provide documentation to verify that they are unable to pay rent due to financial impacts related to COVID-19. Many county superior courts are tolling deadlines via emergency order.",-2.5,0,0,0,0,0,0,0,-0.5,-2,0,USA
Beverly Hills,California,United States,City,34.0696501,-118.3963062,TRUE,Moratorium on evictions for non-payment of rent & moratorium on no-fault evictions,1,Eviction Protection,https://www.beverlyhills.org/cbhfiles/storage/files/1091025194202295965/Ordinance20-O-2807.pdf,,Eviction Cases & Enforcement Suspended,"The Judicial Council of California adopted emergency rules preventing the issuance of summons and the entry of default in all foreclosure and eviction cases, including commercial, unless there is a threat to public health. The rules also postpone trials for at least 60 days. The Governor has issued an executive order banning the enforcement of eviction orders, and tolling response time for new eviction complaints, for renters affected by COVID-19 through May 31, 2020. This order still allows for local governments to pass their own stricter eviction bans. Since the Governor had previously issued an order giving local governments authority to halt evictions, slow foreclosures, and protect against utility shutoffs, several local governments have adopted coronavirus-specific eviction restrictions. Most of these require tenants to provide documentation to verify that they are unable to pay rent due to financial impacts related to COVID-19. Many county superior courts are tolling deadlines via emergency order.",3,0,0,0,0,0,0,2,0,-2,3,USA
Long Beach,California,United States,City,33.7690164,-118.1916048,TRUE,"The city has placed a moratorium on evictions for non-payment of rent for tenants who have lost income because the pandemic and whose rent was due between 3/4/2020 (retroactively)-5/31/2020. Tenants are then required to provide documentation of substantial income losses caused by job layoffs, out-of-pocket medical expenses or requirements to stay at home due to COVID-19. City Council also voted for the Housing Authority to suspend the termination of housing assistance payments through May 31, aimed at ensuring recipients are able to comply with the Cityâ€™s Safer at Home order.",3,Eviction Protection,http://www.longbeach.gov/press-releases/evictions-suspended-for-tenants-affected-by-covid-19/,,Eviction Cases & Enforcement Suspended,"The Judicial Council of California adopted emergency rules preventing the issuance of summons and the entry of default in all foreclosure and eviction cases, including commercial, unless there is a threat to public health. The rules also postpone trials for at least 60 days. The Governor has issued an executive order banning the enforcement of eviction orders, and tolling response time for new eviction complaints, for renters affected by COVID-19 through May 31, 2020. This order still allows for local governments to pass their own stricter eviction bans. Since the Governor had previously issued an order giving local governments authority to halt evictions, slow foreclosures, and protect against utility shutoffs, several local governments have adopted coronavirus-specific eviction restrictions. Most of these require tenants to provide documentation to verify that they are unable to pay rent due to financial impacts related to COVID-19. Many county superior courts are tolling deadlines via emergency order.",-3.5,0,0,0,0,-1,0,0,-0.5,-2,0,USA
San Diego County,California,United States,County,32.9637838,-116.7706277,TRUE,"San Diego County enacted a moratorium on all evictions of residential and commercial renters in the unincorporated areas who have seen their income reduced or been otherwise substantially economically harmed by the COVID-19 pandemic. Even with the moratorium in place, affected residents would still be required to pay back the rent owed at a later date if they miss a payment. As part of the same proposal, supervisors also approved placing a freeze on foreclosures and foreclosure-related evictions.",2,Eviction Protection,https://www.sandiegouniontribune.com/news/politics/story/2020-03-24/san-diego-county-approves-moratorium-on-residential-and-commercial-evictions-for-those-impacted-by-covid-19,,Eviction Cases & Enforcement Suspended,"The Judicial Council of California adopted emergency rules preventing the issuance of summons and the entry of default in all foreclosure and eviction cases, including commercial, unless there is a threat to public health. The rules also postpone trials for at least 60 days. The Governor has issued an executive order banning the enforcement of eviction orders, and tolling response time for new eviction complaints, for renters affected by COVID-19 through May 31, 2020. This order still allows for local governments to pass their own stricter eviction bans. Since the Governor had previously issued an order giving local governments authority to halt evictions, slow foreclosures, and protect against utility shutoffs, several local governments have adopted coronavirus-specific eviction restrictions. Most of these require tenants to provide documentation to verify that they are unable to pay rent due to financial impacts related to COVID-19. Many county superior courts are tolling deadlines via emergency order.",0,0,0,0,0,0,0,2,0,-2,0,USA
Half Moon Bay,California,United States,City,37.4635519,-122.4285862,TRUE,"No landlord can evict a tenant or terminate a tenancy for not paying rent due to the coronavirus pandemic. If a tenant can provide documentation within 14 days of receiving the form that the inability to pay rent is because of COVID-19 the tenant cannot be evicted. After May 31, 2020, tenants owe landlords the amount of rent not paid during this period. Tenants will be given a grace period of up to 180 days to repay the rent owed.",2,Eviction Protection,https://www.hmbreview.com/news/county-issues-moratorium-on-some-evictions/article_683d7e76-6e06-11ea-96b7-b7991e0fbae5.html,,Eviction Cases & Enforcement Suspended,"The Judicial Council of California adopted emergency rules preventing the issuance of summons and the entry of default in all foreclosure and eviction cases, including commercial, unless there is a threat to public health. The rules also postpone trials for at least 60 days. The Governor has issued an executive order banning the enforcement of eviction orders, and tolling response time for new eviction complaints, for renters affected by COVID-19 through May 31, 2020. This order still allows for local governments to pass their own stricter eviction bans. Since the Governor had previously issued an order giving local governments authority to halt evictions, slow foreclosures, and protect against utility shutoffs, several local governments have adopted coronavirus-specific eviction restrictions. Most of these require tenants to provide documentation to verify that they are unable to pay rent due to financial impacts related to COVID-19. Many county superior courts are tolling deadlines via emergency order.",-1,0,0,0,0,-1,0,2,0,-2,0,USA
Benicia,California,United States,City,38.049365,-122.1585777,TRUE,"Stay on evictions for non-payment of rent in the city. The order does not relieve tenants of liability for unpaid rent but puts a moratorium on evictions for non-payment of rent due to the impact of COVID-19, and includes provisions for eviction notices and no-fault evictions, according to a city news release.",2,Eviction Protection,https://patch.com/california/benicia/benicia-puts-moratorium-evictions-city-coronavirus,,Eviction Cases & Enforcement Suspended,"The Judicial Council of California adopted emergency rules preventing the issuance of summons and the entry of default in all foreclosure and eviction cases, including commercial, unless there is a threat to public health. The rules also postpone trials for at least 60 days. The Governor has issued an executive order banning the enforcement of eviction orders, and tolling response time for new eviction complaints, for renters affected by COVID-19 through May 31, 2020. This order still allows for local governments to pass their own stricter eviction bans. Since the Governor had previously issued an order giving local governments authority to halt evictions, slow foreclosures, and protect against utility shutoffs, several local governments have adopted coronavirus-specific eviction restrictions. Most of these require tenants to provide documentation to verify that they are unable to pay rent due to financial impacts related to COVID-19. Many county superior courts are tolling deadlines via emergency order.",0,0,0,0,0,-3,0,4,0,-2,1,USA
Tulare,California,United States,County,36.2516475,-118.852583,FALSE,"There is a call for the county administrative officer to send a letter to the Tulare County Superior Court requesting it to pause or suspend eviction proceedings ""in light of impacts from COVID-19."" Such a step would require board action.",2,,https://www.visaliatimesdelta.com/story/news/2020/03/24/tulare-county-supervisor-calls-eviction-moratorium-amid-covid-19-pandemic/2909123001/,,Eviction Cases & Enforcement Suspended,"The Judicial Council of California adopted emergency rules preventing the issuance of summons and the entry of default in all foreclosure and eviction cases, including commercial, unless there is a threat to public health. The rules also postpone trials for at least 60 days. The Governor has issued an executive order banning the enforcement of eviction orders, and tolling response time for new eviction complaints, for renters affected by COVID-19 through May 31, 2020. This order still allows for local governments to pass their own stricter eviction bans. Since the Governor had previously issued an order giving local governments authority to halt evictions, slow foreclosures, and protect against utility shutoffs, several local governments have adopted coronavirus-specific eviction restrictions. Most of these require tenants to provide documentation to verify that they are unable to pay rent due to financial impacts related to COVID-19. Many county superior courts are tolling deadlines via emergency order.",0,0,0,0,0,0,0,2,0,-2,0,USA
Broward County,Florida,United States,County,26.1598074,-80.4623642,TRUE,"""The Broward Sheriffâ€™s Office, in coordination with the 17th Judicial Circuit, has decided to
temporarily cease all eviction activities until further notice due to the current public health crisis.""",2,Eviction Protection,http://www.17th.flcourts.org/wp-content/uploads/2020/03/20-3-23.pdf,,COVID-19 Related Eviction Cases Suspended,"On April 2, Governor DeSantis suspended statutes giving a cause of action for eviction related to COVID19 and foreclosure for 45 days. The Florida Supreme Court suspended the requirement for the clerk to issue writs of possession ""forthwith"" until May 29th.",-0.5,0,0,0,0,0,0,2,0,-2.5,0,USA
Emeryville,California,United States,City,37.8314089,-122.2865266,TRUE,,2,Eviction Protection,https://emeryville.legistar.com/View.ashx?M=F&ID=8220076&GUID=C9170208-8B7C-475C-86DD-1FDE2DC2ED81,,Eviction Cases & Enforcement Suspended,"The Judicial Council of California adopted emergency rules preventing the issuance of summons and the entry of default in all foreclosure and eviction cases, including commercial, unless there is a threat to public health. The rules also postpone trials for at least 60 days. The Governor has issued an executive order banning the enforcement of eviction orders, and tolling response time for new eviction complaints, for renters affected by COVID-19 through May 31, 2020. This order still allows for local governments to pass their own stricter eviction bans. Since the Governor had previously issued an order giving local governments authority to halt evictions, slow foreclosures, and protect against utility shutoffs, several local governments have adopted coronavirus-specific eviction restrictions. Most of these require tenants to provide documentation to verify that they are unable to pay rent due to financial impacts related to COVID-19. Many county superior courts are tolling deadlines via emergency order.",0,0,0,0,0,0,0,2,0,-2,0,USA
Denver,Colorado,United States,City,39.7392364,-104.9848623,TRUE,The Denver Sheriff Department will temporarily redeploy sheriff deputies away from evictions to other duties.,2,,https://www.denvergov.org/content/denvergov/en/mayors-office/newsroom/2020/city-and-county-of-denver-covid-19-response-update.html,,Eviction Cases & Enforcement Suspended,"Colorado's Governor issued an executive order that prohibits enforcement of evictions and filing of eviction cases for nonpayment of rent. The order also prohibits late fees. It extends provisions of an earlier order that direct certain departments to work with landlords and banks to find lawful means of avoiding evictions, as well as asks sheriffs and other local enforcement to avoid executing evictions. The governor has also directed that some foreclosure sale deadlines are extended to April 30, and treasurers are authorized to waive delinquent interest on delinquent property tax payments. Colorado's Chief Justice issued an order suspending non-essential court functions; the order gives lower court judges discretion to determine whether matters not specifically mentioned in the order (which evictions are not) should be heard. Nearly all judicial districts and several counties have issued orders continuing most civil matters or ordering them to be done via teleconference. Sheriffs in the city of Denver are not executing orders of eviction. Finally, several utilities providers in Colorado have suspended shutoffs; several towns and cities have asked providers to do the same or else said that they will not disconnect service.",-1,0,0,0,0,0,0,2,0,-4,1,USA
Clearlake,California,United States,City,38.9582307,-122.6263728,TRUE,,2,Eviction Protection,https://www.clearlake.ca.us/AgendaCenter/ViewFile/Agenda/_03192020-456,,Eviction Cases & Enforcement Suspended,"The Judicial Council of California adopted emergency rules preventing the issuance of summons and the entry of default in all foreclosure and eviction cases, including commercial, unless there is a threat to public health. The rules also postpone trials for at least 60 days. The Governor has issued an executive order banning the enforcement of eviction orders, and tolling response time for new eviction complaints, for renters affected by COVID-19 through May 31, 2020. This order still allows for local governments to pass their own stricter eviction bans. Since the Governor had previously issued an order giving local governments authority to halt evictions, slow foreclosures, and protect against utility shutoffs, several local governments have adopted coronavirus-specific eviction restrictions. Most of these require tenants to provide documentation to verify that they are unable to pay rent due to financial impacts related to COVID-19. Many county superior courts are tolling deadlines via emergency order.",2,0,0,0,0,-1,0,4,0,-2,1,USA
West Virginia,West Virginia,United States,State,38.4758406,-80.8408415,TRUE,"Because of the coronavirus emergency, the West Virginia Supreme Court has suspended virtually all court proceedings in West Virginia from March 23 through May 15, 2020. The Supreme Court has said that Landlord-Tenant cases are not â€œemergencies,â€ so eviction cases will not be handled between these dates.",1,Eviction Protection,https://www.lawv.net/Resources/Self-Help-Library/Coronavirus/Coronavirus-COVID-19-and-Evictions,,Civil Cases Suspended,"The West Virginia Supreme Court of Appeals issued an order staying all trials, proceedings, statutes of limitations and other court deadlines for non-emergency actions between March 22 and April 10. The city of Morgantown has suspended utilities service disconnections.",2.5,0,0,0,0,0,0,0,-0.5,3,0,USA
Blaine County,Idaho,United States,County,43.3336455,-113.8808311,TRUE,The court is only hearing certain matters (not evictions) until further notice.,2,Eviction Protection,https://www.5thjudicialdistrict.com/wp-content/uploads/Blaine1.pdf,,Resumed Evictions,"Idaho had a statewide order directing that eviction cases be continued except for emergencies. However, on April 22nd, the Supreme Court issued an order resuming all hearings remotely, effective May 1st. Some counties have moved to reduced operations in the court system, and are therefore hearing a limited number of cases that don't include eviction cases. 3 private companies have promised to suspend utility shutoffs.",1,0,0,0,0,0,0,2,0,-1,0,USA
Osceola County,Florida,United States,County,28.0443842,-81.1437541,TRUE,Osceola County Sheriff Russ Gibson announced at a Wednesday briefing that his agency will not enforce any evictions â€œuntil the emergency situation is over.â€,2,,https://www.orlandosentinel.com/coronavirus/os-ne-health-coronavirus-seminole-brevard-evictions-suspended-20200318-mkygvhhmkbacxonpl3on7gakye-story.html,,COVID-19 Related Eviction Cases Suspended,"On April 2, Governor DeSantis suspended statutes giving a cause of action for eviction related to COVID19 and foreclosure for 45 days. The Florida Supreme Court suspended the requirement for the clerk to issue writs of possession ""forthwith"" until May 29th.",-0.5,0,0,0,0,0,0,2,0,-2.5,0,USA
Dane County,Wisconsin,United States,County,43.0709273,-89.4322174,TRUE,"The Dane County Sheriffâ€™s Office said it is temporarily suspending Civil Execution Orders (Writs of Restitution, Writs of Assistance, Writs of Replevin, Execution Against Property) and also temporarily suspending court ordered evictions.",3,,https://madison.com/ct/news/local/govt-and-politics/madison-mayor-asks-for-moratorium-on-evictions-county-placing-homeless/article_02195b89-c2e8-5976-af3c-2bc3280aa157.html,,Eviction Cases & Enforcement Suspended,"The Governor has prohibited the commencement of eviction actions based on failure to pay rent and foreclosure and has prohibited the sheriffs from initiating a sheriff's sale of foreclosed property or execution of eviction orders. The Supreme Court of Wisconsin has suspended in person hearings statwide and is requiring the use of technology in lieu of in person courtroom appearances. Wisconsin has directed court personnel to conduct proceedings using technology but has not cancelled or continued proceedings generally and left discrection to local courts. Some county circuit courts have postponed many types of hearings, often including eviction cases. In some locations, however, circuit courts have specified that evictions will proceed, in some cases noting that appearances should occur by telephone. There is a statutory time limit in Wisconsin for scheduling hearings after a party has raised a defense in an eviction action. (Wis. Stat. 799.206) In Wisconsi, evictions are small claims cases.",-4.5,0,0,0,0,0,0,2,0,-6.5,0,USA
